Col0,Col0_HREF,Col1,Col2,Col3,Col4,Col5,Col6_HREF,Col7_SRC
"Islam Ahmadiyya on X: """"Ahmadi Muslims in Germany have built a ...",https://twitter.com/AhmadiyyaDE/status/856798086689161218,X (formerly Twitter),› AhmadiyyaDE,25 Apr 2017 ... Ahmadi Muslims in Germany have built a Mobile Eye Clinic. It'll soon depart for Africa—provide a range of essential eye treatments for free.,...,Germany,https://twitter.com/AhmadiyyaDE/status/856798086689161218,https://encrypted-tbn0.gstatic.com/images?q=tbn:ANd9GcQi_ipCNrwsmqNr4mIkE7ih842X2lDYHKtoFUlDVZxYoFeRyYBAwLeWntc&s
Abraham Olvera (@abraham_olvera1) / X,https://twitter.com/abraham_olvera1,X (formerly Twitter),› abraham_olvera1,... eye screening. A crucial step towards enhancing diabetic eye care with AI ... on Germany's national broadcatser. @ZDF. as the AI Safety Summit begins ...,eye,eye,,
Ritu Bhanot (@bhanot_ritu) / X,https://twitter.com/bhanot_ritu,X (formerly Twitter),› bhanot_ritu,"... doctor, eye specialist or bone specialist in France. It's very expensive but ... Germany for better rates. I have to borrow money to eat. Sad truth of ...",eye specialist,Germany,https://twitter.com/bhanot_ritu,https://encrypted-tbn0.gstatic.com/images?q=tbn:ANd9GcSG_F8C_w3rdJQIUZHTGRC7sDAoXw1yU4DsM6O6DwvAqiN-ZthOE2ZxsQ&s
Hanna Spielmann (@HannaSpielmann) / X,https://twitter.com/HannaSpielmann,X (formerly Twitter),› HannaSpielmann,"Berlin, Germany Joined March 2018. 83 Following · 17 Followers · Posts · Replies · Media ... #MedTwitter #eyes #Ophthalmology. 1. 2.",Germany,eyes,https://twitter.com/HannaSpielmann,https://encrypted-tbn0.gstatic.com/images?q=tbn:ANd9GcRay5JjY7rDp7XLI-ds9o9ovhPUx1vCk8GLMH4vlfXWpKonJIOu_Ip0Hr0&s
Acta Ophthalmologica (@ActaOphthalmol) / X,https://twitter.com/ActaOphthalmol,X (formerly Twitter),› ActaOphthalmol,"from Germany, China, and Vietnam (AOS.16696, Figure 2). https ... ophthalmology journals. Follow the link below to read a historical perspective of our ...",Germany,ophthalmology,https://twitter.com/ActaOphthalmol,https://encrypted-tbn0.gstatic.com/images?q=tbn:ANd9GcT-vYjlWWCaE6mqvK9RfpCVEbSY9UD2joyOsrz9od8N80MacNo6_sijGjRW&s
Dr. Nana Nhyira Boahene (@DrBoahene) / X,https://twitter.com/drboahene?lang=bg,X (formerly Twitter),› drboahene,Eye Doctor|Football Enthusiast |Member of the World Council of Optometry ... Bayern & Germany. 2 хил. 21 хил. 173 хил.,Eye Doctor,Germany,https://twitter.com/drboahene?lang=bg,https://encrypted-tbn0.gstatic.com/images?q=tbn:ANd9GcQ_iADW8YZvRRazuKZoaKdUXyDiGc43VccdBzHq7Nq2bLIlX9ldEwqUeGg&s
Lukas von Grambusch (@LukasvGrambusch) / X,https://twitter.com/lukasvgrambusch,X (formerly Twitter),› lukasvgrambusch,"If you are new here, my new is Lukas, I am a 1st year Ophthalmology Resident in Germany. ... I produce videos about my life as an eye doctor. #residency # ...",Ophthalmology,Germany,https://twitter.com/lukasvgrambusch,https://encrypted-tbn0.gstatic.com/images?q=tbn:ANd9GcRXDZbHEbK1iMzW1XAzH9Cw_R-w2OxRBa37yjHHHVw5csYDLYzXcl7vxgg&s
Yehia Hashad (@hashaye1) / X,https://twitter.com/hashaye1,X (formerly Twitter),› hashaye1,... eye disease! Learn more in our full announcement with @Novaliq: https://bit ... Great trip visiting our colleagues in Germany for business reviews and a tour ...,eye,Germany,https://twitter.com/hashaye1,https://encrypted-tbn0.gstatic.com/images?q=tbn:ANd9GcQpAfoY50gqkp1zBDeIrBokB3bxm1an2_veNMtXXHhY5g6M0z8vgwECX6s&s
Ruth Hamilton (@ruthiedeh) / X,https://twitter.com/ruthiedeh,X (formerly Twitter),› ruthiedeh,"Eye Hospital has a vacancy for an Ocular Genetics Clinical Fellow, intended for #ophthalmologists who wish to learn more of the clinical, molecular and ...",ophthalmologists,,https://twitter.com/ruthiedeh,https://encrypted-tbn0.gstatic.com/images?q=tbn:ANd9GcSKABCpw0HL13OI41Hv6DA_2Ia0sqnvxeInne3PbHvJIATNqWDwbCPDSw5z&s
ALI H (@aliseyecare) / X,https://twitter.com/aliseyecare,X (formerly Twitter),› aliseyecare,"Blue light Protection lenses from world best brand Carl Zeiss-Germany available at Alis Eye Care & Contact Lens Clinic, Clare Road, Byculla. Image. 1.",Germany,Eye,,
Custom Surgical (@CustomSurgical) / X,https://twitter.com/customsurgical,X (formerly Twitter),› customsurgical,"Dec 14, 2021. What makes MicroREC so useful for doctors? We asked dr. Bader Khayat, anterior segment surgeon from Munich, Germany ... ophthalmology #medsale ...",Germany,ophthalmology,https://twitter.com/customsurgical,https://encrypted-tbn0.gstatic.com/images?q=tbn:ANd9GcRR8DW7EnLCTUWSOK-wzZu8kcLXdTRh23pJadlpY-OWFdUU39ICiGZ72vc&s
Drashti Netralaya (@omtrust) / X,https://twitter.com/omtrust,X (formerly Twitter),› omtrust,Venkataswamy Memorial Award 2024! Your dedication and commitment to ophthalmology and providing the best care to fight off any ophthalmologist concerns of the ...,ophthalmology,ophthalmologist,https://twitter.com/omtrust,https://encrypted-tbn0.gstatic.com/images?q=tbn:ANd9GcQKteWtnp0gTQUGpO4YCdztnEKmlWxu0aSr1HWML4LuWuRBulZr2QnHN7cC&s
Alem Mekonnen (@AlemMekonnen) / X,https://twitter.com/alemmekonnen,X (formerly Twitter),› alemmekonnen,"On #InternationalWomensDay Stefanie Gedenk from Germany shares her hopes for a post-pandemic world. ... But luckily, he's been operated on in an eye clinic ...",Germany,eye clinic,https://twitter.com/alemmekonnen,https://encrypted-tbn0.gstatic.com/images?q=tbn:ANd9GcTeljxfbs3JASpH9QGoYek9kkaSNYEdCLga1dTjdaghBfUu5lx0UOMWl3NA&s
Eye Shield Tech (@EyeShieldTech) / X,https://twitter.com/eyeshieldtech,X (formerly Twitter),› eyeshieldtech,Eye Shield Technology is an international supplier of innovative surgical eye care products. ... TECH FRIDAY: Germany eyes implants for ageing population http:// ...,Eye,eye,https://twitter.com/eyeshieldtech,https://encrypted-tbn0.gstatic.com/images?q=tbn:ANd9GcQPevog01mSDVGTkYGyUrtqm27kxGCiHWbw7BhWzMfcD993BXkoErZurDk&s
"Thailand Medical News on X: """"Protecting Eyes from Blue Light with ...",https://twitter.com/ThailandMedicaX/status/1848208074475196914,X (formerly Twitter),› ThailandMedicaX,21 Oct 2024 ... ... Germany #Thailand #Australia #Sydney #Auckland #Bangkok #Boston. ... #BlueLight #Ophthalmology #News #Eyes #Vision #Blindness #Health ...,...,Germany,https://twitter.com/ThailandMedicaX/status/1848208074475196914,https://encrypted-tbn0.gstatic.com/images?q=tbn:ANd9GcQTU6LFwzFO0F7GDkHBJVwxOxpdkdbljmupfLUGja_9Dc1aN4lJqww7fA&s=0
Ahmad A. Aref (@ahmadaref) / X,https://twitter.com/ahmadaref,X (formerly Twitter),› ahmadaref,"Chicago Eye Surgeon. ... Germany (7.3%, GDP 3.5T USD), China (9.59%, GDP 11.2T USD), and the U.S. (11.237%, GDP 18.57T USD) are top three contributors ...",Eye,Germany,https://twitter.com/ahmadaref,https://encrypted-tbn0.gstatic.com/images?q=tbn:ANd9GcQG4eHC3UZb401CLdB8mXoBx73Yb2RZ-z4259PuXXUmxADIYD3pS72g9Rf1&s
Tom Rawstorne (@Rawsty) / X,https://twitter.com/rawsty,X (formerly Twitter),› rawsty,Dr. Assad will return to ophthalmology after being deposed as president of Syria and plans to set up an eye clinic in Russia. Follow: @AFpost.,ophthalmology,eye clinic,https://twitter.com/rawsty,https://encrypted-tbn0.gstatic.com/images?q=tbn:ANd9GcSfWDvfmjkgU2rUtRlW1oY8KN-4n_ReI8O9fNHMNXq55__EZ9tp221yKExN&s
Kostantinos Mouratis (@KMouratis) / X,https://twitter.com/kmouratis,X (formerly Twitter),› kmouratis,Operations Manager @LHD @LeipzigHeartInstitute | A.I and ML Specialist | Design Thinker | Aspiring Neuroscientist. ... Germany #cardiotwitter https ...,Specialist,Germany,https://twitter.com/kmouratis,https://encrypted-tbn0.gstatic.com/images?q=tbn:ANd9GcQF8NSxB2kkrvh_izpqPA1RIh89Epn9qNFn1kaXoF64MFKLM7u_eY2qjsU&s
"FCI Ophthalmics on X: """"#DOG2024 is coming soon!   #FCI will be ...",https://twitter.com/FCI_Ophthalmics/status/1843662616226328586,X (formerly Twitter),› FCI_Ophthalmics,8 Oct 2024 ... ... Germany.     The team is looking forward to seeing you all! https://t.co/GgovkzHSkh https://t.co/GgovkzHSkh #ophthalmology #expert.,...,Germany,,
Rohit Varma (@DrRohitVarma) / X,https://twitter.com/drrohitvarma,X (formerly Twitter),› drrohitvarma,"Personal Twitter account of Dr. Rohit Varma, MD, MPH. Ophthalmologist and researcher specializing in epidemiology, public health and glaucoma.",Ophthalmologist,,https://twitter.com/drrohitvarma,https://encrypted-tbn0.gstatic.com/images?q=tbn:ANd9GcSIiS4a-BT3Pe4IYy29Up2XgJvcDldO2qAbJSwnuriJ1WGpKEKgX2mLJMkW&s
Qasim Malik (@MalikMq1) / X,https://twitter.com/malikmq1,X (formerly Twitter),› malikmq1,... germany #usa #surgeon. Image ... optometrist #glaucoma #surgery #oftalmologia #plasticsurgery #doctor #lasiksurgery #aats.,germany,optometrist,,
"Association Philippe Jabre on X: """"Have you read our latest interview ...",https://twitter.com/APJLebanon/status/1380425166329675776,X (formerly Twitter),› APJLebanon,"9 Apr 2021 ... ... aspiring ophthalmologist, and we spoke to her during her internship in Germany https://t.co/YPDw1b3lhp #Ophthalmology #associationphilippejabre.",...,ophthalmologist,https://twitter.com/APJLebanon/status/1380425166329675776,https://encrypted-tbn0.gstatic.com/images?q=tbn:ANd9GcTmCQASc6QsyQt52NcXYIb9fbs84M_gYl_W47-iipnGuxGVi3MTDGOR8W8&s
Corinne Doria (@CorinneDoria1) / X,https://twitter.com/corinnedoria1,X (formerly Twitter),› corinnedoria1,"Lecturer in History and General Education at CUHK-Shenzhen. Scholar of the History of medicine, ophthalmology, and visual impairment.",ophthalmology,,https://twitter.com/corinnedoria1,https://encrypted-tbn0.gstatic.com/images?q=tbn:ANd9GcSlzRYrT5FAIO3VudzSxueOFMWR5eWVwcr-4dyeKMmrGs6dJ4SpA8nb3BQc&s
Thomas Ritter (@ThomasR55937842) / X,https://twitter.com/thomasr55937842,X (formerly Twitter),› thomasr55937842,"Bayern & Germany · @iMiaSanMia. ·. Oct 18. As was the case last year, Allianz ... eye health has on their growth and learning. With 450M kids facing vision ...",Germany,eye,https://twitter.com/thomasr55937842,https://encrypted-tbn0.gstatic.com/images?q=tbn:ANd9GcSTWMmpK_SRhyywIUqVS-6exjcK7I9bKwp2kXf0rv3H5ipxQv65sX9wz10y&s
Alice Swinton (@aswinton) / X,https://twitter.com/aswinton,X (formerly Twitter),› aswinton,"Germany Joined May 2009. 88 Following · 22 ... The Himalayan Cataract Project, and their team of doctors bring light into people's eyes, around the world.",Germany,doctors,https://twitter.com/aswinton,https://encrypted-tbn0.gstatic.com/images?q=tbn:ANd9GcS36Sl4oKqZPDZvwhouA6a3HCtbcAte5z0_fIusxH4zZutFeFjs6O8mYJ0q&s
@keelerglobal (@KeelerLtd) / X,https://twitter.com/keelerltd,X (formerly Twitter),› keelerltd,Visit stand #5102 and say hello to our regional experts Shane Breen & Justin Skinner. See you there! @ARVOInfo · #Ophthalmologists.,Ophthalmologists,,https://twitter.com/keelerltd,https://encrypted-tbn0.gstatic.com/images?q=tbn:ANd9GcQwV8kfx8lODrvM0K356Mx4i3swz0GjGpb-spJMG3y0YQs1fljOU6J1iaCX&s
Valerie Weigmann (@vweigmann) / X,https://twitter.com/vweigmann,X (formerly Twitter),› vweigmann,"Walking in his footsteps in Wilhelmsfeld, Germany In 1886, our National Hero, Dr. ... José Rizal's steps in Heidelberg: This is the old eye clinic where Dr.",Germany,eye clinic,https://twitter.com/vweigmann,https://encrypted-tbn0.gstatic.com/images?q=tbn:ANd9GcQbX-WEuIpgsJCGQnKzyzOHFxVSIRMBNuZvMGrmgennvRVoq8un1IW2vAw&s
"Arye Pulli on X: """"Injuries to keep an eye on during the week: QB ...",https://twitter.com/AryePulli/status/1838654434471215150,X (formerly Twitter),› AryePulli,24 Sept 2024 ... His injury has been kept under wraps. 49ers RB Christian McCaffrey (Achilles tendinitis) visited a specialist in Germany. I'd be very ...,...,specialist,https://twitter.com/AryePulli/status/1838654434471215150,https://encrypted-tbn0.gstatic.com/images?q=tbn:ANd9GcTrAP9-Le4i6PTKO-e3F1ziuJh2XxCRDM9eHoGCDyiNfd8rvyIHGW2XXzTp&s
Star boy (@nonsoboy25) / X,https://twitter.com/nonsoboy25,X (formerly Twitter),› nonsoboy25,says goodbye to 35 doctors and nurses he brought to GH from Germany to ... How can an eye doctor have cancer of the eye?! Idris went through the ...,Germany,eye doctor,https://twitter.com/nonsoboy25,https://encrypted-tbn0.gstatic.com/images?q=tbn:ANd9GcTmj6r4Q-xeMEofJ6M_dv8Hb4mwvdkb2NqMnAc_3URPKKl9PxIP7Us2VP7m&s
Pasquale V (@Peeves3) / X,https://twitter.com/peeves3,X (formerly Twitter),› peeves3,Proud 🏳️‍   Canadian Eye Doctor.,Eye Doctor,,,