Col0,Col0_HREF,Col1,Col2,Col3,Col4,Col5,Col6,Col7_HREF,Col8_SRC,
Ambler Surgical (@AmblerSurgical) / X,https://twitter.com/amblersurgical,X (formerly Twitter),› amblersurgical,"Quality, Precision, Reliability Handcrafted in Germany, Geuder instruments ... retinal care to your patients. Together, let's keep eyes healthy ...",Germany,retinal,,https://twitter.com/amblersurgical,https://encrypted-tbn0.gstatic.com/images?q=tbn:ANd9GcR_RBOpTN49uTwD81Zd3ZdHlsjLGb814IZSUryOVmo9nT7nqmS3hkUJPWYB&s,
Wacker Chemie (@wackerchemie) / X,https://twitter.com/wackerchemie,X (formerly Twitter),› wackerchemie,We are expanding our specialty silicone manufacturing capacities in China. Learn more in our ... retinal-related vision loss http://wch.ag/9Yof9. Image.,specialty,retinal,,https://twitter.com/wackerchemie,https://encrypted-tbn0.gstatic.com/images?q=tbn:ANd9GcQ7elnyXYJMSI9w4fkxUZnCEUA38boqulBl8kBFZdybYCL92wPcofyoKAQ&s,
David A. Merle (@DocDaveAM) / X,https://twitter.com/docdaveam,X (formerly Twitter),› docdaveam,What is driving the new case records in Germany? The people who aren't ... retinal degeneration in retinal explant model. Well done everyone! https ...,Germany,retinal,retinal,https://twitter.com/docdaveam,https://encrypted-tbn0.gstatic.com/images?q=tbn:ANd9GcTGueuGPCPVgtUfKF9HFrIqUyUPPe6N_FO4pDjozAy7iX6KRySaQJvUmDKn&s,
Arshad Khanani (@ArshadKhanani) / X,https://twitter.com/arshadkhanani,X (formerly Twitter),› arshadkhanani,"meeting in Hamburg, Germany! Thanks. @anirvan0419. for the opportunity ... The 40th meeting of American Society of Retina Specialists. @asrsdocs. is off ...",Germany,Retina Specialists,,,,
"Qi Cui, MD PhD (@CuiLab) / X",https://twitter.com/cuilab,X (formerly Twitter),› cuilab,"Nov 2. A century ago, Germany's democracy was hijacked by a bombastic ... retinal disease, achieving 100x sight improvement sustained for 1 year. The ...",Germany's,retinal,,https://twitter.com/cuilab,https://encrypted-tbn0.gstatic.com/images?q=tbn:ANd9GcSGkGfH7hqOhxMrg3bZ5Advf8TIUHjwOVHXV6ZKLZqaGoKvwdxNnBQ2Gyw&s,
Springer Nature Surgery (@SpringerSurgery) / X,https://twitter.com/springersurgery,X (formerly Twitter),› springersurgery,"Springer Nature in Germany, the UK & the US has been honoured with the ... retinal pigment alterations -chronic central serouschorioretinopathy.",Germany,retinal,,https://twitter.com/springersurgery,https://encrypted-tbn0.gstatic.com/images?q=tbn:ANd9GcQkQSeNq2w-iEXBNin-au0OKF1JRv1dutOgJsBBkfp2Lagzi2XT7QezgkI&s,
HEINE Optotechnik (@HEINEOpto) / X,https://twitter.com/heineopto,X (formerly Twitter),› heineopto,Quality made in Germany ... Retinal imaging in eye care has become a highly relevant tool for patient ...,Germany,Retinal,,https://twitter.com/heineopto,https://encrypted-tbn0.gstatic.com/images?q=tbn:ANd9GcQKRq__lG_E-Maup0Kwi3h5L9HyJjkUa3_srU_25kE-3Bn9eyAneQEubzHZ&s,
Dr Akhter Uddin (@DrAkhterUddin) / X,https://twitter.com/drakhteruddin,X (formerly Twitter),› drakhteruddin,"Associate Professor Of Ophthalmology,Expert in Phaco& Vitreo Retinal Surgeon, Writer,Founder of Philanthropic organization. ... MBBS, DO,ICO fellow Germany on ...",Retinal Surgeon,Germany,,https://twitter.com/drakhteruddin,https://encrypted-tbn0.gstatic.com/images?q=tbn:ANd9GcQB3WdQVfA16OtRYKmOK4RD_leG9T2lwHFCsBtN-a9Luykv2tOMAMxri4c&s,
Philipp Berens (@CellTypist) / X,https://twitter.com/CellTypist,X (formerly Twitter),› CellTypist,"Our paper """"GABAergic amacrine cells balance biased chromatic information in the mouse retina"""" is now published in @CellReports https://cell.com/cell-reports/f ...",retina,,,https://twitter.com/CellTypist,https://encrypted-tbn0.gstatic.com/images?q=tbn:ANd9GcQptR6BhByaddMtbkokPbBEcknqHjgRH7zicgmr-4a95ydE_4UX2aq82WkK&s,
OCULUS Surgical (@oculussurgical) / X,https://twitter.com/oculussurgical,X (formerly Twitter),› oculussurgical,"... retina, glaucoma or comprehensive surgeon https://oculus.de/f/tLnY821 ... We are present at the Frankfurt Retina Meeting in Mainz, Germany, which starts tomorrow.",retina,surgeon,Retina,https://twitter.com/oculussurgical,https://encrypted-tbn0.gstatic.com/images?q=tbn:ANd9GcRCLkvdhSJkROJJwnUyMtBg1SbJHhaceqqNTBKNi1boH3Ul8il9EATbz20&s,
George Mavro (@mavroinc) / X,https://twitter.com/mavroinc,X (formerly Twitter),› mavroinc,"Nov 14, 2016. Report: Germany's Carl #Zeiss Looking ... Optometrist's, ophthalmologists and retina specialists-become a prescriber of #homevisionmonitor.",Germany's,retina specialists,,https://twitter.com/mavroinc,https://encrypted-tbn0.gstatic.com/images?q=tbn:ANd9GcSHlzxiXPE7E3ijtAxBGPovmCZegYtlPP1IkJXqV3B6akrLj8SBqt5ZtJc&s,
Philipp Berens (@CellTypist) / X,https://twitter.com/CellTypist,X (formerly Twitter),› CellTypist,"Our paper """"GABAergic amacrine cells balance biased chromatic information in the mouse retina"""" is now published in @CellReports https://cell.com/cell-reports/f ...",retina,,,https://twitter.com/CellTypist,https://encrypted-tbn0.gstatic.com/images?q=tbn:ANd9GcQptR6BhByaddMtbkokPbBEcknqHjgRH7zicgmr-4a95ydE_4UX2aq82WkK&s,
Ryan (@RyanWagster) / X,https://twitter.com/RyanWagster/,X (formerly Twitter),› RyanWagster,Nov 7 · $OTLK will be able to reach more Retina specialists and Ophthalmologists through Cencora Retina Consultants of America To Be Acquired By Cencora For Up ...,Retina specialists,Retina Consultants,,https://twitter.com/RyanWagster/,https://encrypted-tbn0.gstatic.com/images?q=tbn:ANd9GcRok33TFenW9pNiSawPOB0jPQyjlCWlJlRQWtAQaJtvZv_fy6U6zwN7awJu&s,
Piyush Bansal (@drpiyushbansal) / X,https://twitter.com/drpiyushbansal,X (formerly Twitter),› drpiyushbansal,Retinal surgeon l Photographer l Traveller l Romantic VENI VIDI VICI. ... Germany has got testing spot on. They plan to test hundreds of thousands for the ...,Retinal surgeon,Germany,,https://twitter.com/drpiyushbansal,https://encrypted-tbn0.gstatic.com/images?q=tbn:ANd9GcS5-Mqn6Qm31-VjAQ7BuGbsLuzrKXyaJ71DET6nS67J6BYaz1qB5t7i_Sg&s,
Qasim Malik (@MalikMq1) / X,https://twitter.com/malikmq1,X (formerly Twitter),› malikmq1,... germany #usa #surgeon. Image ... retina #optometry #optometrist #glaucoma #surgery #oftalmologia #plasticsurgery #doctor #lasiksurgery #aats. Image.,germany,surgeon,retina,,,
charlie wardrop (@charlie_epipole) / X,https://twitter.com/charlie_epipole,X (formerly Twitter),› charlie_epipole,"Fife-based Epipole lands £1.5 million funding round INVERKEITHING-based Epipole, the video retinal imaging specialist, has secured £1.5 million in new ...",retinal,specialist,,https://twitter.com/charlie_epipole,https://encrypted-tbn0.gstatic.com/images?q=tbn:ANd9GcTyCedVfNlwzKvIdIUEHIhcNlAnG7IgWQpEplFQDMa9zfDNVtV8piQSINg9&s,
Dr. Anshuman Gahlot (@anshumaan_india) / X,https://twitter.com/anshumaan_india,X (formerly Twitter),› anshumaan_india,"Eye Specialist and Vitreo Retina Surgeon. Bikaner Joined September 2011. 335 ... From US to Singapore, Germany to Thailand. The world continues to stand ...",Retina Surgeon,Germany,,https://twitter.com/anshumaan_india,https://encrypted-tbn0.gstatic.com/images?q=tbn:ANd9GcTXFje0_96U2i8qOkwiURV-Ix2iAnA_fezuP0Rrs3ZGnj0vLBqAU0Z3IVs&s,
Ryte (@RyteAI) / X,https://twitter.com/RyteAI,X (formerly Twitter),› RyteAI,"@Moorfields. Eye Hospital, London, UK) as the world's leading expert on Retinal Detachment. ... Georg-August University, Germany) as the world's leading expert on ...",expert,Retinal,Germany,https://twitter.com/RyteAI,https://encrypted-tbn0.gstatic.com/images?q=tbn:ANd9GcQN8amHFrxsDcCM3iKuThy9QCjAktyxaK0vakmlHg4tCm_ptYL565yWPjY&s,
Wacker Chemie (@wackerchemie) / X,https://twitter.com/wackerchemie,X (formerly Twitter),› wackerchemie,We are expanding our specialty silicone manufacturing capacities in China. Learn more in our ... retinal-related vision loss http://wch.ag/9Yof9. Image.,specialty,retinal,,https://twitter.com/wackerchemie,https://encrypted-tbn0.gstatic.com/images?q=tbn:ANd9GcQ7elnyXYJMSI9w4fkxUZnCEUA38boqulBl8kBFZdybYCL92wPcofyoKAQ&s,
Srksota - X.com,https://twitter.com/srksota,X (formerly Twitter),› srksota,"doctor eye/ Retina and Phaco surgeon/ loves history/ supports Truth how harsh it may be. Manipal Karnataka / दिलिवाल/ Joined September 2019. 1,753 ...",doctor,Retina,surgeon,https://twitter.com/srksota,https://encrypted-tbn0.gstatic.com/images?q=tbn:ANd9GcT9okgG0Hs-7KRRHIKPq76EIZz-jFKWK6JIIiTG4ochUNc2oP76UbeGlO8&s,
PELOBiotech GmbH - X,https://twitter.com/pelobiotech?lang=en,X (formerly Twitter),› pelobiotech,"Martinsried, Germany ... In this work the researchers used Human Retinal Microvascular Endothelial Cells ordered from us and our Cellovations endothelial cell ...",Germany,Retinal,,https://twitter.com/pelobiotech?lang=en,https://encrypted-tbn0.gstatic.com/images?q=tbn:ANd9GcSD7kLIYBxTnm1-c8oF0HypHzwEsw8tC4PIo8M9FGZL9eG1-Qz8fXGo-hqw&s,
SurgiCube - X.com,https://twitter.com/surgicube,X (formerly Twitter),› surgicube,"Ramón Hilberink on LinkedIn: Let's meet in Hamburg, Germany this week: Euretina booth H61. ... We welcome all visitors that attent the Milano Retina Meeting June ...",Germany,Retina,,https://twitter.com/surgicube,https://encrypted-tbn0.gstatic.com/images?q=tbn:ANd9GcQrcNtB93st1bGC1q88hNRqfng2MX9H3CMEncOpF9SGudkUhGZwpfQcG7NZ&s,
Avril Daly (@avrilbdaly) / X,https://twitter.com/avrilbdaly,X (formerly Twitter),› avrilbdaly,"Health Equality Advocate, lover of art & anthropology, living in Dublin, working for Retina International - views are my own.",Retina,,,https://twitter.com/avrilbdaly,https://encrypted-tbn0.gstatic.com/images?q=tbn:ANd9GcTVDwg068VCFmHZ1_A8jmvA2Wkzq3eDNL2XxCYSv5hU98rwNoGojbAUt3dS&s,
"Marty Chargin on X: """"$APLS Apellis Pharmaceuticals, Inc. (Nasdaq ...",https://twitter.com/MartyChargin/status/1837100651467133216,X (formerly Twitter),› MartyChargin,"20 Sept 2024 ... ... Germany. """"As an ophthalmologist and retina specialist, I have seen how patients with GA lose their ability to read, drive, and even see faces.",...,Germany,retina specialist,,,
Kumar Saurabh (@SaurabhK__) / X,https://twitter.com/SaurabhK__,X (formerly Twitter),› SaurabhK__,Vitreoretina Surgeon Scientific Author Reviewer Editor.,Surgeon,,,,,
charlie wardrop (@charlie_epipole) / X,https://twitter.com/charlie_epipole,X (formerly Twitter),› charlie_epipole,"Fife-based Epipole lands £1.5 million funding round INVERKEITHING-based Epipole, the video retinal imaging specialist, has secured £1.5 million in new ...",retinal,specialist,,https://twitter.com/charlie_epipole,https://encrypted-tbn0.gstatic.com/images?q=tbn:ANd9GcTyCedVfNlwzKvIdIUEHIhcNlAnG7IgWQpEplFQDMa9zfDNVtV8piQSINg9&s,
RICOH IT HUB (@RicohITHub) / X,https://twitter.com/RicohITHub,X (formerly Twitter),› RicohITHub,#Azziad #Worldcoin #Germany HP Spectre 14 x360 new model Intel Core i7 11th Gen 16GB RAM 512GB SSD 13.5” TOUCHSCREEN Stylus pen Backlit keyboard ...,Germany,,,https://twitter.com/RicohITHub,https://encrypted-tbn0.gstatic.com/images?q=tbn:ANd9GcQJ53bSGiRYFDG1sZLOqIp8N_CEs8_3pvgqh7XloP90hS3U9hzfThFeU_c&s,
Piyush Bansal (@drpiyushbansal) / X,https://twitter.com/drpiyushbansal,X (formerly Twitter),› drpiyushbansal,Retinal surgeon l Photographer l Traveller l Romantic VENI VIDI VICI. ... Germany has got testing spot on. They plan to test hundreds of thousands for the ...,Retinal surgeon,Germany,,https://twitter.com/drpiyushbansal,https://encrypted-tbn0.gstatic.com/images?q=tbn:ANd9GcS5-Mqn6Qm31-VjAQ7BuGbsLuzrKXyaJ71DET6nS67J6BYaz1qB5t7i_Sg&s,
Simon J. Clark (@ProfClark) / X,https://twitter.com/profclark,X (formerly Twitter),› profclark,"Tübingen, Germany eye-tuebingen.de/clark/ Joined June 2021 ... Investing in vision: Innovation in retinal therapeutics and the influence on venture capital ...",Germany,retinal,,https://twitter.com/profclark,https://encrypted-tbn0.gstatic.com/images?q=tbn:ANd9GcTYgQ8HJaBQKYozYsJHrOgNxeO5QcbzOQ5fGxvQjZYos3w_EtdwDCxtdUU&s,
UCSB NRI (@UCSB_NRI) / X,https://twitter.com/ucsb_nri,X (formerly Twitter),› ucsb_nri,... Germany http://stemcell.ucsb.edu/news/. Image ... RT @GladstoneLabs: What do growing retinal neurons look like?,Germany,retinal,,https://twitter.com/ucsb_nri,https://encrypted-tbn0.gstatic.com/images?q=tbn:ANd9GcRJOQ85RFqpjuPvV8wkXPdEal5_UgpQseO-Ohc-QkqlvLGAtVMibObrQOYK&s,
Inès Jmel Boyer (@ijmelboyer) / X,https://twitter.com/ijmelboyer,X (formerly Twitter),› ijmelboyer,"Up to £10,000 per research project Scope of neurological conditionals and retinal ... Germany and Scotland. https://buff.ly/3XLZavc. Image. 2.",retinal,Germany,,https://twitter.com/ijmelboyer,https://encrypted-tbn0.gstatic.com/images?q=tbn:ANd9GcROAT4GC-opv4pqTLYobOsFfTFzf26r6uN_M-REt2-7A4j14erjkBwuMbmk&s,
Blueprint LSG (@BlueprintLSG) / X,https://twitter.com/blueprintlsg,X (formerly Twitter),› blueprintlsg,... Retina Specialists 2023 Annual Meeting. ir.opthea.com. Opthea to Feature at the American Society of Retina Specialists 2023 Annual Meeting | Opthea... Podium ...,Retina Specialists,Retina Specialists,,https://twitter.com/blueprintlsg,https://encrypted-tbn0.gstatic.com/images?q=tbn:ANd9GcQccVx0Cw6ULilRv2dH4H47XD9GqVZjaKmKGN-1tvtlDlHqNdxD8JNHoxc&s,
Otium Planning Group (@otiumplanning) / X,https://twitter.com/otiumplanning,X (formerly Twitter),› otiumplanning,"Imagine you have been working from home for the last three days and your computer screen is burned into the back of your retina. ... Germany, for the ...",retina,Germany,,https://twitter.com/otiumplanning,https://encrypted-tbn0.gstatic.com/images?q=tbn:ANd9GcSnUUZQcVi7HZAnAIAraE4VQ7dj3btHAOjzsTl5Ob6pvtb2azpaM3qeCNPG&s,
Katrin Marx (@KatrinMarx_BL) / X,https://twitter.com/katrinmarx_bl,X (formerly Twitter),› katrinmarx_bl,B+L product specialists having fun. Join them at booth 101! #EURETINA18 ... Gathering of the retinal world at Frankfurt Retina Meeting in Mainz. This ...,specialists,retinal,Retina,https://twitter.com/katrinmarx_bl,https://encrypted-tbn0.gstatic.com/images?q=tbn:ANd9GcRPisi0wQy7PkIleg92QXHNTLAURzcmFtqEd-CczdKVkhPFCTDHhKqErd3P&s,
Karla (@karlaarz) / X,https://twitter.com/karlaarz,X (formerly Twitter),› karlaarz,"... Germany. Our friend María Fernanda Sánchez has not been located since ... Text to the left says: Retina, Expert,. Scientific Day of #RetinaDublin takes ...",Germany,Retina,Expert,https://twitter.com/karlaarz,https://encrypted-tbn0.gstatic.com/images?q=tbn:ANd9GcSBwhPu3QeHNHB8vP9UUn9eprE20F0P3MMNMqrAzZcq-E7XBs4my6RDOkY&s,
Avril Daly (@avrilbdaly) / X,https://twitter.com/avrilbdaly,X (formerly Twitter),› avrilbdaly,"Health Equality Advocate, lover of art & anthropology, living in Dublin, working for Retina International - views are my own.",Retina,,,https://twitter.com/avrilbdaly,https://encrypted-tbn0.gstatic.com/images?q=tbn:ANd9GcTVDwg068VCFmHZ1_A8jmvA2Wkzq3eDNL2XxCYSv5hU98rwNoGojbAUt3dS&s,
BlueVine Graphene (@BGIgraphene) / X,https://twitter.com/bgigraphene,X (formerly Twitter),› bgigraphene,"... expert Mark Priestly tells CNBC's One Second in F1. ... An artificial retina made of """"miracle material"""" graphene has been developed by physicists in Germany.",expert,retina,Germany,https://twitter.com/bgigraphene,https://encrypted-tbn0.gstatic.com/images?q=tbn:ANd9GcT9qR_2VbY7fQG5VeDEDQdNSw1zz3XsD3GBYDuCjnT1Gd9Sru0QKl9i42Q&s,
UCSB NRI (@UCSB_NRI) / X,https://twitter.com/ucsb_nri,X (formerly Twitter),› ucsb_nri,... Germany http://stemcell.ucsb.edu/news/. Image ... RT @GladstoneLabs: What do growing retinal neurons look like?,Germany,retinal,,https://twitter.com/ucsb_nri,https://encrypted-tbn0.gstatic.com/images?q=tbn:ANd9GcRJOQ85RFqpjuPvV8wkXPdEal5_UgpQseO-Ohc-QkqlvLGAtVMibObrQOYK&s,
Simon J. Clark (@ProfClark) / X,https://twitter.com/profclark,X (formerly Twitter),› profclark,"Tübingen, Germany eye-tuebingen.de/clark/ Joined June 2021 ... Investing in vision: Innovation in retinal therapeutics and the influence on venture capital ...",Germany,retinal,,https://twitter.com/profclark,https://encrypted-tbn0.gstatic.com/images?q=tbn:ANd9GcTYgQ8HJaBQKYozYsJHrOgNxeO5QcbzOQ5fGxvQjZYos3w_EtdwDCxtdUU&s,
Babak Mostaghaci (@ba_mater) / X,https://twitter.com/ba_mater,X (formerly Twitter),› ba_mater,"@ba_mater. Scholarly Publishing Expert | Former Scientist & Engineer | Tweets are my own! Berlin, Germany Joined February 2013. 581 Following · 757 Followers.",Expert,Germany,,https://twitter.com/ba_mater,https://encrypted-tbn0.gstatic.com/images?q=tbn:ANd9GcRLXdVbOTZGpxT9uQf21e6bWwBoLJs509r03NYlwgxRM6ZtAw9i0bGeh1g&s,
SurgiCube - X.com,https://twitter.com/surgicube,X (formerly Twitter),› surgicube,"Ramón Hilberink on LinkedIn: Let's meet in Hamburg, Germany this week: Euretina booth H61. ... We welcome all visitors that attent the Milano Retina Meeting June ...",Germany,Retina,,https://twitter.com/surgicube,https://encrypted-tbn0.gstatic.com/images?q=tbn:ANd9GcQrcNtB93st1bGC1q88hNRqfng2MX9H3CMEncOpF9SGudkUhGZwpfQcG7NZ&s,
Patricia Moreira (@MoreiraTricia) / X,https://twitter.com/moreiratricia,X (formerly Twitter),› moreiratricia,"Now Berlin, Germany!! Joined November 2011. 1,356 Following · 1,357 Followers ... Expert H. Wetchell from. @MyKludo. says the case """"demonstrates the ...",Germany,Expert,,https://twitter.com/moreiratricia,https://encrypted-tbn0.gstatic.com/images?q=tbn:ANd9GcRVYTM2ZuYyICwfjj0tSUTPODhRvPBNChlxVZbdbl44qqr6IHeAOIPOppeJ&s,
Kumar Saurabh (@SaurabhK__) / X,https://twitter.com/SaurabhK__,X (formerly Twitter),› SaurabhK__,Vitreoretina Surgeon Scientific Author Reviewer Editor.,Surgeon,,,,,
Inga @Eickemeyer (@IngaEickemeyer) / X,https://twitter.com/ingaeickemeyer,X (formerly Twitter),› ingaeickemeyer,Avian ophthalmology workshop at the famous Al Wasl Falcon Clinic! #eickemeyer ... Visiting a local vet to use #RETevet and establish if the retina is ...,Clinic,the retina,,https://twitter.com/ingaeickemeyer,https://encrypted-tbn0.gstatic.com/images?q=tbn:ANd9GcRe4j-zDAarl5lY2oi4F_k6W6dkcCBxvWTvpF38U2dH72V5DAg8Tn-G3x8&s,
Gautam Kumar (@GautamKumar636) / X,https://twitter.com/gautamkumar636,X (formerly Twitter),› gautamkumar636,"Frankfurt, Germany inbond.tech Joined July 2019. 115 Following · 56 Followers ... Get your free ebook Rock Due Diligence as an expert today on Product Hunt!",Germany,expert,,https://twitter.com/gautamkumar636,https://encrypted-tbn0.gstatic.com/images?q=tbn:ANd9GcSDUKrIAf6qNLvhMI52NerLqszLkYbmOq6RoiJBBJCQ0IB86MSw4zqp3Y8&s,
Ning Zhang (@NingZhang_en) / X,https://twitter.com/NingZhang_en,X (formerly Twitter),› NingZhang_en,"He is an expert on #metabolic function & #disease and the use of ... (Germany) now 27th-29th June 2022, registration & abstract submission open ...",expert,Germany,,https://twitter.com/NingZhang_en,https://encrypted-tbn0.gstatic.com/images?q=tbn:ANd9GcT8RnDOyJvilTjfPleEDBpHTr46IWv5b1wKLZf70KJ6Z1Wuj3RhQ1qYA50&s,
Adrian M (@marsi00) / X,https://twitter.com/marsi00,X (formerly Twitter),› marsi00,"The Roland BK-9 Backing Keyboard was announced a number of weeks ago at the Musikmesse show in Frankfurt, Germany. ... Specialist, demonstrates the Roland Jupiter ...",Germany,Specialist,,,,
Tammy Leitsinger (@TLeitsinger) / X,https://twitter.com/tleitsinger,X (formerly Twitter),› tleitsinger,"... retinal hemorrhage caused by a #carotidartery that was almost 100% blocked. Thanks to #TCAR and vascular surgeons at Carilion Clinic, he has a lot to smile ...",retinal,Clinic,,https://twitter.com/tleitsinger,https://encrypted-tbn0.gstatic.com/images?q=tbn:ANd9GcSBVEDe1cQvWNkvTM_X0mzYVq0iBj-aDCsaQ3-Sa9z1zVDUaAsfyc3t20k&s,
Expert TechnoMarkt (@expert_TechnoM) / X,https://twitter.com/expert_technom,X (formerly Twitter),› expert_technom,"Bavaria, Germany expert-technomarkt.de Born 1995 Joined July 2011. 7 ... AppleSmartphoneiPhone 6s 32GB spacegraufür nur 299€4,7"""" Retina HD Display (11 ...",Germany expert,Retina,,https://twitter.com/expert_technom,https://encrypted-tbn0.gstatic.com/images?q=tbn:ANd9GcTKukDmzIfULpEuGP8bYtgHfxFP3rcnoU0LihU6jsIvd-531AQ3i-5HsKI&s,
David Eisner (@DavidAEisner) / X,https://twitter.com/davidaeisner,X (formerly Twitter),› davidaeisner,"The Inaugural IUPS Beacon Meeting in Tutzing, Germany is going really well. ... retinal function. https://hubs.la/Q02RDpG-0 In our #Neuroscience ...",Germany,retinal,,https://twitter.com/davidaeisner,https://encrypted-tbn0.gstatic.com/images?q=tbn:ANd9GcTakaYuZefPNxE-Kpe5FaWQE49g5H9ed-mzWExP_VHW2DkHlpO7wt_UXKsh&s,
Creative Computing (@CC423WallStreet) / X,https://twitter.com/CC423WallStreet,X (formerly Twitter),› ...,Princeton NJ's Apple Specialists. We help people get the most out of their Apple products. Purchase to ... Germany in the World... http://fb.me/6TSrj1hVc.,Specialists,Germany,,,,
Vinayagamani S (@vinmani_inr) / X,https://twitter.com/vinmani_inr,X (formerly Twitter),› vinmani_inr,... Germany ,Thanks to BALT team for organising the advanced INR observership ... Middle aged man with recurrent right monocular transient vision loss (retinal ...,Germany,retinal,,https://twitter.com/vinmani_inr,https://encrypted-tbn0.gstatic.com/images?q=tbn:ANd9GcRhWlssYihZokrYKGbREH4qbGjHG_lYPUxCf0Jj0UVtzv60Jmv9qULaAFdK&s
The iWhore (@theiwhore) / X,https://twitter.com/theiwhore,X (formerly Twitter),› theiwhore,Your one-stop small business solutions specialist. I am a full ... Make Germany Great Again ~ Adolf Hitler. Quote. Kamala Harris · @KamalaHarris.,specialist,Germany,,https://twitter.com/theiwhore,https://encrypted-tbn0.gstatic.com/images?q=tbn:ANd9GcRiiZojJskE632K7b3slJhcuk-g2W1W-dCafJj8rwlrygxSOBIK25KCmNU&s,
Mintsweetie - X,https://twitter.com/mintsweetie,X (formerly Twitter),› mintsweetie,"Nov 1. If you are a woman, waking up in Germany today, there are no spaces in ... the retina. She has twice finished fastest loser due to presence of a ...",Germany,the retina,,,,
Rouble Singh (@roublesingh881) / X,https://twitter.com/roublesingh881,X (formerly Twitter),› roublesingh881,"... Germany and Japan to counter the British in India. In 1942, he was honoured ... iPhone XR with the all-new Liquid Retina display. Embedded video. 0:15.",Germany,Retina,,https://twitter.com/roublesingh881,https://encrypted-tbn0.gstatic.com/images?q=tbn:ANd9GcQjctQRl6l2wzAyk3oGjX9kyTOQVI6m-cXr6jEP7dMWeL6LyyfVziZ05A4&s,
Vos (@Vos023) / X,https://twitter.com/vos023,X (formerly Twitter),› vos023,"HARD TRUTH FOR GERMANY: “One NordStream 2 ... This is the line you do NOT cross No palm scan, no retinal scan, no thumb print, no palm print, no chip.",GERMANY,retinal,,https://twitter.com/vos023,https://encrypted-tbn0.gstatic.com/images?q=tbn:ANd9GcSrZLJxFfOXQS_VlMAp27_MwjxwYg2Dp54C5B5niekI08xvXaZM-oH8QH8&s,
